{
  "task_id": "self-evolution-step-5",
  "title": "Step 5: Comprehensive Unit & Integration Tests",
  "status": "DRAFTED",
  "risk_tier": "auto",
  "workspace_scope": {
    "allow": [
      "scratch/"
    ],
    "deny": [
      ".agents/",
      ".claude/",
      ".opencode/",
      "AGENTS.md",
      "memory/"
    ]
  },
  "objective": "Construct end-to-end integration and unit tests validating spec synthesis, telemetry tracking, AST formatting, and checkpoint rollback mechanisms.",
  "worker": {
    "model": "openai:gpt-5.6-luna",
    "max_attempts": 2,
    "hybrid_critic_model": "openai:gpt-5.6-luna",
    "hybrid_max_repair_turns": 3,
    "hybrid_max_tokens": 32000,
    "hybrid_max_cost_usd": 0.3,
    "hybrid_max_identical_verdicts": 2
  },
  "inputs": [],
  "outputs": [
    {
      "path": "scratch/self_evolution/test_self_evolution.py"
    }
  ],
  "acceptance_checks": [
    {
      "id": "check-test-suites",
      "kind": "content_regex",
      "path": "scratch/self_evolution/test_self_evolution.py",
      "expected": "def test_spec_synthesis|def test_telemetry|def test_ast_formatter|def test_checkpoint_rollback"
    }
  ],
  "quality_spec": {
    "required_sections": [
      "test_spec_synthesis",
      "test_telemetry",
      "test_ast_formatter",
      "test_checkpoint_rollback",
      "test_e2e_evolution_loop"
    ],
    "quality_dimensions": {
      "completeness": 0.5,
      "correctness": 0.5
    },
    "hard_failures": [
      "syntax_error",
      "missing_rollback_test",
      "missing_synthesis_test"
    ],
    "minimum_score": 0.9
  },
  "qc": {
    "required": true,
    "lens": "code_correctness"
  }
}