{
  "task_id": "spec-telemetry-step-2",
  "title": "Step 2: Implement automated spec synthesis in orchestrator/planner.py",
  "status": "DRAFTED",
  "risk_tier": "auto",
  "workspace_scope": {
    "allow": [
      "scratch/"
    ],
    "deny": [
      ".agents/",
      ".claude/",
      ".opencode/",
      "AGENTS.md",
      "memory/"
    ]
  },
  "objective": "Add automated spec synthesis capabilities to orchestrator/planner.py to dynamically generate structured task specifications.",
  "worker": {
    "model": "hybrid:gemini:gemini-3.7-flash",
    "max_attempts": 3,
    "hybrid_critic_model": "gemini:gemini-3.7-flash",
    "hybrid_max_repair_turns": 3,
    "hybrid_max_tokens": 32000,
    "hybrid_max_cost_usd": 0.3,
    "hybrid_max_identical_verdicts": 2
  },
  "inputs": [],
  "outputs": [
    {
      "path": "scratch/spec_telemetry/step2_planner_impl.py"
    }
  ],
  "acceptance_checks": [
    {
      "id": "check-step2-output",
      "kind": "content_regex",
      "path": "scratch/spec_telemetry/step2_planner_impl.py",
      "expected": "def synthesize_spec|class SpecSynthesizer"
    }
  ],
  "quality_spec": {
    "required_sections": [
      "imports",
      "synthesis_logic",
      "validation"
    ],
    "quality_dimensions": {
      "completeness": 0.4,
      "correctness": 0.6
    },
    "hard_failures": [
      "syntax_error",
      "unhandled_schema_validation"
    ],
    "minimum_score": 0.85
  },
  "qc": {
    "required": true,
    "lens": "code_correctness"
  }
}