{
  "task_id": "evidence-json-test-b",
  "title": "B",
  "status": "DRAFTED",
  "risk_tier": "auto",
  "workspace_scope": {
    "allow": [
      "scratch/"
    ],
    "deny": []
  },
  "objective": "B",
  "worker": {
    "model": "hybrid:gemini:gemini-3.7-flash",
    "max_attempts": 3,
    "hybrid_critic_model": "openai:gpt-4o-mini",
    "hybrid_max_repair_turns": 3,
    "hybrid_max_tokens": 32000,
    "hybrid_max_cost_usd": 0.3,
    "hybrid_max_identical_verdicts": 2
  },
  "inputs": [],
  "outputs": [
    {
      "path": "scratch/test_json_b.txt"
    }
  ],
  "acceptance_checks": [
    {
      "id": "chk-min_size",
      "kind": "min_size",
      "path": "scratch/test_json_b.txt",
      "expected": 1
    },
    {
      "id": "chk-content",
      "kind": "content_regex",
      "path": "scratch/test_json_b.txt",
      "expected": ".+"
    }
  ],
  "qc": {
    "required": false,
    "lens": "code_correctness"
  },
  "quality_spec": {}
}