{
  "task_id": "goal-orch-step-5",
  "title": "Step 5: Create and execute unit and integration test suite",
  "status": "DRAFTED",
  "risk_tier": "auto",
  "workspace_scope": {
    "allow": [
      "scratch/"
    ],
    "deny": [
      ".agents/",
      ".claude/",
      ".opencode/",
      "AGENTS.md",
      "memory/"
    ]
  },
  "objective": "Run comprehensive test suite covering spec synthesis, live telemetry updates, and checkpoint rollback triggers with empiric test results.",
  "worker": {
    "model": "openai:gpt-5.6-luna",
    "max_attempts": 2,
    "hybrid_critic_model": "openai:gpt-5.6-luna",
    "hybrid_max_repair_turns": 3,
    "hybrid_max_tokens": 32000,
    "hybrid_max_cost_usd": 0.3,
    "hybrid_max_identical_verdicts": 2
  },
  "inputs": [],
  "outputs": [
    {
      "path": "scratch/orchestrator_enhancements/test_verification_report.json"
    }
  ],
  "acceptance_checks": [
    {
      "id": "check-5",
      "kind": "content_regex",
      "path": "scratch/orchestrator_enhancements/test_verification_report.json",
      "expected": "\"passed\":\\s*true|\"status\":\\s*\"success\""
    }
  ],
  "quality_spec": {
    "required_sections": [
      "unit_test_results",
      "integration_test_results",
      "coverage_metrics"
    ],
    "quality_dimensions": {
      "test_coverage": 0.5,
      "correctness": 0.5
    },
    "hard_failures": [
      "failing_tests",
      "untested_rollback_path"
    ],
    "minimum_score": 0.9
  },
  "qc": {
    "required": true,
    "lens": "code_correctness"
  }
}