{
  "task_id": "self-evolution-tests",
  "title": "Step 5: Comprehensive Unit and E2E Integration Tests in tests/test_self_evolution.py",
  "status": "DRAFTED",
  "risk_tier": "auto",
  "workspace_scope": {
    "allow": [
      "scratch/"
    ],
    "deny": [
      ".agents/",
      ".claude/",
      ".opencode/",
      "AGENTS.md",
      "memory/"
    ]
  },
  "objective": "Create unit and end-to-end integration tests in tests/test_self_evolution.py covering spec synthesis, telemetry calculation, resilient checkpoint rollback, and AST auto-formatting.",
  "worker": {
    "model": "openai:gpt-5.6-luna",
    "max_attempts": 2,
    "hybrid_critic_model": "openai:gpt-5.6-luna",
    "hybrid_max_repair_turns": 3,
    "hybrid_max_tokens": 32000,
    "hybrid_max_cost_usd": 0.3,
    "hybrid_max_identical_verdicts": 2
  },
  "inputs": [],
  "outputs": [
    {
      "path": "scratch/self_evolution/test_self_evolution.py"
    }
  ],
  "acceptance_checks": [
    {
      "id": "check-test-classes",
      "kind": "content_regex",
      "path": "scratch/self_evolution/test_self_evolution.py",
      "expected": "class TestSelfEvolution"
    },
    {
      "id": "check-test-cases",
      "kind": "content_regex",
      "path": "scratch/self_evolution/test_self_evolution.py",
      "expected": "def test_"
    }
  ],
  "quality_spec": {
    "required_sections": [
      "TestSpecSynthesis",
      "TestTelemetry",
      "TestCheckpointRollback",
      "TestASTFormatter",
      "TestE2ESelfEvolution"
    ],
    "quality_dimensions": {
      "completeness": 0.5,
      "correctness": 0.5
    },
    "hard_failures": [
      "syntax_error",
      "failing_tests",
      "mock_bypass_without_assertion"
    ],
    "minimum_score": 0.9
  },
  "qc": {
    "required": true,
    "lens": "code_correctness"
  }
}